special_unique_id,school_id,special_id,sp_name,limit_year,degree,level1_name,level2_name,level3_name,content
123_709122,123,709122,信息安全,四年,工学学士,本科(普通),工学,计算机类,本专业是国家一流专业建设点、湖南省首批一流本科建设点专业、湖南省特色专业。本专业面向国家重大需求，适应社会和信息安全发展需要，培养扎实掌握计算机、数学、通信等方面的知识基础、全面掌握信息安全领域的基本理论、实践技能、设计方法和实现技术、具备先进技术的自我学习和提升能力、良好的沟通能力和团队合作精神、能够从事技术研究、产品设计、工程项目管理、系统运行维护、信息安全管理执法等工作，解决网络空间安全复杂工程问题的高级工程技术人才。专业注重信息安全相关的实践能力的培养，拥有湖南省声探测与信息对抗湖南省国防科技重点实验室、湖南省网络空间安全研究生创新培养基地、中南大学-合天智汇信息安全实习实训基地等多个教学科研平台，建设有独立的信息安全专业攻防实验平台，与多家信息安全测评与研发中心建立了长期稳定的实习联系，同时成立了学生信息安全俱乐部“极光网安实验室”，创造了多种学习和实践的环境，鼓励学生课外自主学习新的攻防技术，形成了一套有效的课内外相结合提升学生实践能力的培养模式。近年来获得第十三届全国大学生信息安全竞赛一等奖、2019年湖南省大学生网络安全技能竞赛冠军等国际级和省部级竞赛奖励80余项。
123_660531,123,660531,数据科学与大数据技术,四年,工学学士,本科(普通),工学,计算机类,我校为全国首批设置数据科学与大数据专业的三所高校之一。专业实力国内领先，有成熟的培养体系和完善的大数据专业平台。本专业发挥中南大学特色优势，依托医疗大数据应用技术国家工程实验室、湖南省医学大数据协同创新中心、中南大学湘雅大数据科研平台、轨道交通大数据科研平台、有色金属工业大数据科研团队力量实施人才培养，与中国电信等产业集团和知名IT公司共建校企人才合作培养基地，培养面向大数据与相关领域的高级创新型人才。本专业已产生一届毕业生66人，升学22人，其中本校4人，进入北大、上交、中科院等名校攻读的18人，就业31人，出国9人。
123_660519,123,660519,通信工程,四年,工学学士,本科(普通),工学,电子信息类,中南大学通信工程专业起源于上世纪八十年代铁路交通领域信号检测与通信技术，于1992年设立本科专业，2005年获批一级学科硕士学位授予权，拥有通信系统与信息安全二级博士点。以信息与通信工程、计算机科学与技术两个一级学科为核心，融合交通信息工程及控制国家重点学科，形成了完善的人才培养体系。在学科地位、教学质量、科研水平和师资力量等方面已跻身国内高校前列，形成了通信系统与信息安全、轨道交通智能网络通信、智能文本/图像/视频信息处理、无线通信与移动计算、微波/毫米波雷达与智能天线等特色研究方向和量子计算与通信、5G/6G先进通信技术等前沿研究方向。秉承“教书育人、服务社会”的办学理念，定位于培养知识、能力、素质全面发展的拔尖创新型人才，坚持“创新引领，服务社会”的宗旨，潜心治本、改革进取，瞄准通信领域国家发展战略和国际前沿，已发展成为具备一定规模、教学科研人才齐备、教学实验条件完整的重点建设专业。中南大学通信工程专业是湖南省首批一流本科专业建设点，在湖南省普通高校本科专业综合评价中获得A级，位居湖南省第一名。目前已形成了对接国家重大战略需求，行业特色鲜明的专业发展优势； 牢固树立“新工科”理念， 坚持实践“竞赛实训＋科技创新”的创新人才培养模式，不断增进产学合作协同育人，提升学生实践创新能力；积极探索基于慕课的混合式教学改革，打造系列精品教学课程，重点建设通信工程专业系列教材，彰显专业办学特色；深化国内国际交流与合作，提升学生竞争力，有效提高了就业率和升学率。
123_987547,123,987547,生物医学工程,四年,工学学士,本科(普通),工学,生物医学工程类,生物医学工程专业是国家双万计划建设专业，是新医科的领头专业之一。该专业依托基础医学院和学校工科的雄厚实力，成为应用现代工程技术方法，研究疾病的早期诊断和精准化、个性化、微创化治疗的综合性交叉学科。培养具有生物医学、工程技术、信息科学的基础理论知识及科研、技术开发能力，能在医工交叉、电子信息、医疗卫生等领域，从事研究、开发、教学及管理的高层次创新型、复合型人才。
123_6045,123,6045,软件工程,四年,工学学士,本科(普通),工学,计算机类,软件工程专业是国家首批一流本科建设点专业，该专业是对大规模复杂软件系统进行开发、维护和管理的工程性学科。通过多年实践，构建了一套完整的学生工程实践能力和创新创业人才培养体系，注重学生项目开发与管理能力、创新创业能力、团队协作意识和国际竞争力的培养，已经形成了特色鲜明、成效显著的精英型软件人才培养模式。
123_6034,123,6034,建筑学,五年,工学学士,本科(普通),工学,建筑类,专业始建于1995年，是湖南省内较早创立的建筑学专业之一。主要研究建筑物及其环境，通过研究人类建筑活动的规律和方法，创造适合人类生活需求和审美要求的物质形态和空间环境。2003年，获得建筑设计及理论、城市规划与设计、建筑技术科学3个二级学科硕士点。2006年，获得建筑学一级学科硕士点。2008年开始，4次通过建筑学专业教育评估，具有建筑学学士学位和硕士学位授予权。2020年成为国家一流本科专业建设点。通过20多年的发展，目前已成为学科方向明确，教学、实践与科研机构完备，教学质量较高的专业。
123_6035,123,6035,城乡规划,四年,工学学士,本科(普通),工学,建筑类,专业1993年设立，是湖南省内最早创立的城乡规划专业之一。城乡规划以可持续发展思想为理念，以城乡社会、经济、环境的和谐发展为目标，以城乡物质空间为核心，以城乡土地使用为对象，通过城乡规划的编制、公共政策的制定和建设实施的管理，实现城乡发展的空间资源合理配置和动态引导控制。2001年，开始招收本校城乡规划推免硕士研究生；2003年，获城乡规划与设计二级硕士点学位授予权；2006年，获建筑学一级学科硕士学位授予权，设有城市规划与设计（含风景园林规划与设计）学科方向； 2011年，获城乡规划学一级学科硕士学位授予权；2013年，获城市规划硕士专业学位授予权。2009年开始3次通过全国城乡规划专业教育评估。通过近30年的发展，已经建设成为学科方向明确，教学、实践与科研机构完备，教学质量高的专业，发展前景广阔。
123_6102,123,6102,交通运输,四年,工学学士,本科(普通),工学,交通运输类,交通运输专业面向轨道交通特色办学，具有60多年的办学历史，为国家级一流本科专业建设点、国家专业综合改革试点专业、卓越计划试点专业、国家特色专业建设点、湖南省重点专业、中南大学“双一流”建设学科专业，并已连续3次通过国家工程教育专业认证。拥有多个国家级大学生校外实践基地、交通运输工程实践中心、国家虚拟仿真实验教学平台，并与中国国家铁路集团有限公司及其多个下属路局集团有限公司、以及多个城市轨道交通企业建立了长期、稳固的教学科研合作。本专业培养交通运输领域的高素质、复合型人才，毕业生能在交通运输领域、尤其是轨道交通领域、综合交通领域从事交通规划设计、运营管理与教育科研工作。
123_6103,123,6103,交通设备与控制工程,四年,工学学士,本科(普通),工学,交通运输类,交通设备与控制工程专业是为适应我国交通运输行业高速发展需要，2003年由教育部批准设置的新专业。本专业由具有具60余年办学历史的、面向轨道交通行业的机车车辆、工程机械、机械设计制造及其自动化等专业重新组建而成，为国家一流专业建设点、国家专业综合改革与卓越计划试点专业，拥有以中国工程院院士为代表的高水平师资队伍，拥有以教育部重点实验室为依托的先进实验条件。
123_1025448,123,1025448,轨道交通信号与控制,四年,工学学士,本科(普通),工学,自动化类,轨道交通信号与控制专业是国家教育部自动化类专业，主要针对现代轨道交通培养宽口径及多学科相融合的新工科复合型高素质研究人才，涉及交通运输工程、控制科学与工程、电气工程、通信工程、计算机科学与技术等学科。本专业面向高速铁路、干线普速铁路、城市轨道交通、电气及自动化控制、人工智能等领域，突出列车牵引、控制、信号、通信、系统工程等方面。在学科发展过程中转化多项国内轨道交通领域核心技术，同时拥有轨道交通安全国家地方联合工程中心、国家2011轨道交通安全系统创新中心、轨道交通安全教育部重点实验室。
123_709114,123,709114,信息管理与信息系统,四年,管理学学士,本科(普通),管理学,管理科学与工程类,信息管理与信息系统为“管理科学与工程”国家一级重点学科所属专业，该专业将管理科学、信息科学以及计算机科学等学科融为一体，2010年被国家教育部批准为国家级“高等学校特色专业建设点”，2019年获批为 “国家级一流本科专业建设点”。现有专任教师26人，具有高级职称教师24人，已获得博士学位教师25人，教师组成的教学团队于2009年被教育部确定为“国家级教学团队”。
123_6064,123,6064,金融学,四年,经济学学士,本科(普通),经济学,金融学类,金融学专业目前拥有应用经济学一级学科博士点授予权，并已初步形成以金融学为主体、金融工程和金融科技为两翼的“一体两翼式”发展格局，在人才培养国际化、以研促学、重视学生实践能力培养等方面具有鲜明的特色与优势。现为湖南省特色专业，并获批2020年度省级与国家级双一流本科专业建设点。现有教师26人，其中教授8人，副教授13人，国家级百千万人才1人，教育部新世纪优秀人才3人。拥有金融创新、经济行为决策、金融工程与风险管理三大学科研究中心；建有行为金融、量化金融、证券期货、银行业务等实验室。近年来，在行为金融、金融工程、绿色金融、普惠金融、金融科技等领域取得了丰硕成果，且在国内具有重要影响力。
123_6067,123,6067,会计学,四年,管理学学士,本科(普通),管理学,工商管理类,会计学专业拥有会计学硕士授予权（学术类和专业类），在工商管理一级学科博士点下自主设置有会计学博士点。现有教师25人，其中教授6人，副教授13人。建有会计综合模拟实验室、财务共享中心实验室、ERP实验室、沙盘模拟实验室等实习平台及多家校外实践基地，设置有会计研究中心、湖南省中小企业研究中心（省级重点研究基地）等研究机构。本专业形成资本市场与实证会计、资源环境会计、资本运营与公司治理、投融资决策与技术经济、会计信息系统等多个特色研究方向，承担了一系列国家、省部级和校企合作科研项目，在国内外高校中具有一定的示范效应，在实务界形成了良好的社会声誉。2017年湖南省本科专业(会计学)教学评估成绩为A；2019年获批为省级一流本科专业建设点，2020年获批为国家级一流专业建设点。
123_339578,123,339578,国际经济与贸易,四年,经济学学士,本科(普通),经济学,经济与贸易类,经济与贸易系所在学科拥有应用经济学一级学科博士点授予权，有开放型经济发展研究中心、区域发展与演化经济研究中心、房地产经济研究中心，中心全方位支撑国际经贸人才培养。在人才的全球视野、跨文化沟通、实践创新等能力培养方面具有鲜明的特色。现有教师27人，其中教授11人(博士生导师12人)，副教授10人。建有国际商务综合实训、国际贸易实务模拟、国际结算及单证实训、市场营销实训、证券投资模拟与分析、沙盘模拟等实验实习平台。在“一带一路”、有色金属贸易、矿产资源定价、企业国际化经营、服务贸易等领域取得了具有一定影响的特色研究成果。2020年获批为省级一流专业建设点。
123_660541,123,660541,工商管理,四年,管理学学士,本科(普通),管理学,工商管理类,工商管理专业隶属于工商管理一级学科，是面向工商企业管理实践设立的专业。2019年“软科学中国最好学科”排名居前7%，2019年获批第一批 “国家级一流本科专业建设点”。本专业一直秉承“厚基础、宽口径、重实践、强能力、应用型”的人才培养理念，为社会各界培养了一大批工商管理类人才，现有专职教师与研究人员43人，其中教授18人。经过多年的教学和研究积累，专业在战略管理、人力资源本土化管理与开发、生产运作与供应链管理、市场营销等领域取得了一定的特色研究成果，承担了一系列国家、省部级和校企合作科研项目。建设有教育部协同育人项目以及ERP实验室、沙盘模拟实验室、市场营销实训等实验实习平台，并建有多家校外实习基地。
123_6070,123,6070,行政管理,四年,管理学学士,本科(普通),管理学,公共管理类,行政管理专业为中南大学公共管理学科下的二级学科。1999年招收行政管理本科，2001年获行政管理硕士点，2003年获MPA专业学位点，2005年获公共管理一级硕士点，2005年获社会医学与卫生事业管理二级博士点，2012年自主设置组织管理与政策创新二级博士点，2017年获公共管理一级学科博士点，2020年获应急管理二级学科博士点，2002年、2012年两次获评湖南省重点学科，2018年获批湖南省一流本科专业，2021年获批国家一流本科专业。行政管理涵盖公共政策、公共部门人力资源管理、地方治理和应急管理4个专业方向，拥有以教育部新世纪优秀人才、湖南省青年骨干教师、宝钢优秀教师为代表的教学团队，以及全国教育系统社会稳定风险研究评估中心、中国智库索引（CTTI）来源智库等5个研究平台和实践实习基地，在地方治理、政策分析、公共安全和风险评估等领域拥有明显学科特色和行业优势，为政府、企业、事业单位等各类组织培养了大批优秀人才。
123_660536,123,660536,临床医学（五年制）,五年,医学学士,本科(普通),医学,临床医学类,临床医学专业创建于1914年，是国家特色专业，2019年获评国家一流专业。本专业充分发挥综合性大学办学优势，创新人才培养体系，彰显人才培养国际化特色，改革成效显著，造就了一大批医学领军人才和骨干精英。
123_809784,123,809784,精神医学,五年,医学学士,本科(普通),医学,临床医学类,精神医学专业奠基于我国第一代精神病学家凌敏猷教授1934年在学校开创的《精神病学》课程教学，是立足于精神病与精神卫生学国家重点学科和国家级特色专业建设点，2020年获评国家级一流专业建设点。自1988年创建以来，建有国家级教学名师和教学团队、国家精品课程和精品资源共享课，培养了一大批精神医学专业的领军人才和骨干精英。</br>核心课程：解剖学、生理学、病理学、病理生理学、药理学、内科学、外科学、精神病学、行为医学、临床心理学、儿童精神病学、司法精神病学等。
123_660505,123,660505,口腔医学（五年制）,五年,医学学士,本科(普通),医学,口腔医学类,口腔医学专业具有35年办学历史，拥有设施完备、条件先进的教学实验室，高水平口腔专科医院以及5个校内外教学实习基地。本专业师资力量雄厚，已形成了完善的本、硕、博各层次专业人才培养体系。致力于培养临床基础扎实、医工结合紧密、国际视野开阔的行业精英人才。
123_304872,123,304872,能源与动力工程,四年,工学学士,本科(普通),工学,能源动力类,我校能源与动力工程专业入选国家级一流本科专业、湖南省重点专业和特色专业。本专业旨在培养能源高效洁净转化与利用、动力装置设计、动力系统优化运行及自动化控制、制冷与低温工程、能源污染控制等领域具有较高科学素养和人文素质、较强工程实践与创新能力的高级复合型专门人才。专业建有多个国家级、省部级工程中心和重点实验室，与国外高校、国内知名企业建立有广泛开展国际化合作及联合培养机制；专业教师来自于海内外知名高校，学科背景交叉融合，在流程工业节能和污染物防治、中低品位热能利用、区域清洁能源规模化利用及智慧化管理等方面，位居世界前列。
123_660504,123,660504,建筑环境与能源应用工程,四年,工学学士,本科(普通),工学,土木类,我校建筑环境与能源应用工程专业为湖南省一流本科专业建设点。本专业旨在培养建筑节能、工业通风、制冷空调、燃气供应、健康建筑等领域具有较强工程实践和创新能力的高层次复合型专门人才。专业建有国家级、省部级工程中心和重点实验室，积极与国外高校、国内知名企业广泛开展国际化教育和联合培养。专业教师基础深厚，在新型制冷技术、建筑低碳化、轨道交通节能、人工环境营造、人体舒适与健康等方面做出了重要贡献，在国内外享有良好声誉和影响。
123_660535,123,660535,新能源科学与工程,四年,工学学士,本科(普通),工学,能源动力类,我校新能源科学与工程专业是国家第一批批准设立的面向战略性新兴产业发展的新工科专业，获批湖南省一流本科专业建设点。该专业旨在培养太阳能、生物质能、地热能、风能、核能等新能源领域具有较强工程实践和创新能力的高层次复合型人才，毕业生可从事新能源及清洁能源技术开发、系统设计、项目管理等相关工作。我校在该领域建有多个国家级及省部级工程中心和重点实验室，联合国内知名企业建立了一批实训基地。专业教师毕业于海内外知名高校，在太阳能热利用、生物质能转换、地热能综合利用等领域承担了多项重大科研项目，形成了一支创新能力强、思维活跃的教学科研团队。
123_660551,123,660551,数学与应用数学,四年,理学学士,本科(普通),理学,数学类,数学是自然科学的基础，它是研究数学理论并将其知识应用于相关学科的一个专门学科，目前作为基础学科得到国家各级部门高度重视。数学与应用数学专业是学习数学专业相关知识，以及运用数学知识解决数学与相关学科中的问题的数学一级学科本科专业；旨在培养熟练掌握数学科学基本理论与基本方法、受到良好的数学思维训练、具有运用数学知识解决数学及相关领域问题的能力和较高科学研究素质的高级专门人才。
123_6074,123,6074,信息与计算科学,四年,理学学士,本科(普通),理学,数学类,信息与计算科学专业是以信息科学和计算科学的数值方法及相关的数学理论、软件研发及应用为研究对象的数学一级学科本科专业。本专业旨在培养具有扎实的数学基础和良好的数学思维能力，掌握信息科学、计算数学、运筹学和控制论等主干学科的基本理论和方法，具备科学计算能力，并能进行科学研究和解决实际问题的高级专门人才。
123_6077,123,6077,统计学,四年,理学学士,本科(普通),理学,统计学类,统计学专业是关于数据科学的方法论学科，是统计学一级学科本科专业。本专业旨在培养具有扎实的数学和统计基础，掌握系统的统计理论与方法，受到一定的科学研究训练，具有实际工作能力和创新思维能力，能在企事业单位、科研部门从事统计调查、数据管理与量化分析、大数据分析与决策、金融统计等工作的高级专门人才。
123_6080,123,6080,应用物理学,四年,理学学士,本科(普通),理学,物理学类,物理学是研究物质基本结构和一般规律的学科，是自然科学的带头学科，为其他各自然科学学科提供研究基础。应用物理学专业是物理学一级学科本科专业。本专业主要培养数理基础扎实、人文素养深厚、具有创新意识和国际视野的基础学科专业人才和应用型理科创新人才，同时也培养能在物理学及其相关科学技术领域从事科研、教学、技术和相关管理工作的高级复合型人才。
123_6036,123,6036,土木工程,四年,工学学士,本科(普通),工学,土木类,专业始建于1953年，是国家级特色专业和首批改革试点专业。专业涵盖桥梁、隧道、建筑结构和道路工程4个专业方向，拥有以院士和国家级人才为代表的湖南省级教学团队和高速铁路建造技术国家工程实验室、重载铁路工程结构教育部重点实验室、土木工程国家级实验教学示范中心、土木工程虚拟仿真国家级实验教学中心和现代轨道交通建造与运维科普教育基地，在土木工程、轨道交通领域拥有明显学科特色和行业优势，为国家重要基础设施建设培养了大批行业领军人才。
123_6055,123,6055,铁道工程,四年,工学学士,本科(普通),工学,土木类,专业始建于1953年，1995年铁道工程、桥梁工程专业合并更名为交通土建工程专业，1997年改名为土木工程专业，铁道工程是其中的一个专业方向，2015年铁道工程本科专业在全国率先恢复单独招生。面向铁路、城市轨道交通领域，培养线路、轨道、桥梁、隧道、路基和车站设计、施工和养护的高级专业人才。拥有以院士和国家级人才为代表的湖南省级教学团队，依托“土木工程”和“交通运输”2个国家一级重点学科、高速铁路建造技术国家工程实验室、重载铁路工程结构教育部重点实验室，在轨道交通、土木工程领域拥有学科特色和行业优势，为国家铁路和城市轨道交通等基础设施建设培养了大批行业领军人才。
123_6039,123,6039,工程力学,四年,工学学士,本科(普通),工学,力学类,工科类力学一级学科，致力于将力学基础知识应用于各种工程技术开发、工程设计和解决工程难题，培养力学科研人员和高级工程科技人才。该专业是学校的特色专业之一，2020年被确定为湖南省一流本科专业建设点。拥有湖南省普通高等学校基础课示范实验室，力学类国家一流在线课程，湖南省精品课程，国家级规划教材，多名省级教学名师和教学能手，承担国家重点研发计划、国家自然科学基金、湖南省自然科学基金、省部级横向课题等100余项，获省部级、行业协会科技进步奖多项，具有较强的科学研究和人才培养实力。依托土木工程学科和高速铁路建造技术国家工程实验室、土木工程安全科学实验室(湖南省普通高校重点建设实验室)，工程力学专业具有明显的交通土建特色。
