special_unique_id,school_id,special_id,sp_name,limit_year,degree,level1_name,level2_name,level3_name,content
123_660537,123,660537,电子信息工程,四年,工学学士,本科(普通),工学,电子信息类,本专业是湖南省重点专业，瞄准国家发展的重大需求，与电子科学、控制科学、电气工程等学科交叉融合，在信息采集、传输、交换、通信设备与信息系统的设计、研究和开发等领域取得突出成就，是我国电子信息领域科学研究和高层次人才培养基地之一。
123_6091,123,6091,微电子科学与工程,四年,工学学士,本科(普通),工学,电子信息类,本专业依托中南大学“机械工程”国家一级重点学科和“高性能复杂制造”国家重点实验室，集机械、电子、材料、控制、软件等多学科为一体的面向精密微电子/光电子器件制造的交叉专业。本专业拥有以中国工程院院士、973首席科学家、“万人计划”领军人才为代表的雄厚师资队伍，与ASM公司、中科电子集团第45所和赛意法等著名企业建立了教学实践基地，与国际著名的微电子制造装备集团ASM公司等建立了“CSU——ASM微电子封装技术实验室”和MSC-CSU、CSU-Moldflow高级技术联合培训中心，在微电子/光电子制造及其封装领域具有学科特色与行业优势。学生毕业后可在微电子制造、光电子制造、MEMS制造、精密机械、通信、航空航天等相关单位从事微电子/光电子器件的制造工艺与装备研究、技术开发、技术管理、设备运行与维护、经营管理等工作，并为学生进入高等院校和科研院所继续深造奠定基础。
123_1025450,123,1025450,运动训练,四年,教育学学士,本科(普通),教育学,体育学类,本专业旨在培养能够胜任在各级体育专业运动队、学校、企事业单位和其他社会组织中从事体育运动训练、教学、健身指导、管理与科研工作的高素质人才。坚持“专项技能+基础理论+创新精神”的教育理念，依托学校交叉学科的优质教学资源，注重厚基础、精技术、强能力、勇拼搏、讲奉献的人才培养特点，形成突出人体科学理论与专项运动训练相结合的新型专业教学特色，对接学校“创新创业”与“双学位”教育模式，着重培养与发展学生的综合素质，赢得了社会的广泛好评。运动训练专业自设立以来，在新时期综合性高校高水平体育人才培养的教育改革与探索中取得了显著成效，2020年获批湖南省一流本科专业建设点。
123_1726156,123,1726156,临床医学（八年类）,五年,医学学士,本科(普通),医学,临床医学类,临床八年类的临床医学专业创建于1914年，是国家特色专业，自2004年获教育部批准试办八年制医学教育以来，按“八年一贯，整体优化，强化基础，注重临床，培养能力，提高素质”的整体要求，充分发挥综合性大学办学优势，创新人才培养体系，彰显人才培养国际化特色，改革成效显著，2012年获教育部批准实施“卓越医生教育培养计划项目”，致力于培养临床医学拔尖创新人才。
123_805329,123,805329,"口腔医学（""5+3""一体化）",五年,医学学士,本科(普通),医学,口腔医学类,本专业学制８年，学生需要完成５年的口腔医学本科教育和３年专业型研究生教育。本专业培养具有扎实的理论知识、较强的临床分析能力、严谨的科研思维，能够独立进行口腔医学领域内的常见病、多发病的诊断和治疗，达到卫生部颁发的《住院医师规范化培训试行办法》中规定第一阶段培训结束时要求的临床工作水平，获得口腔医学专业硕士学位和住院医生规范化培训合格证书的高素质人才。
123_2153438,123,2153438,艺术与科技,四年,艺术学学士,本科(普通),艺术学,设计学类,<p>		专业代码：130509T</p><p>		授予学位：艺术学学士</p><p>		修学年限：五年/四年</p><p>		开设课程：</p><p>		主干学科：艺术学、工学、文学主要课程：素描、色彩、三大构成、装饰基础、透视学、工程与制图、展示设计、环境设施设计、展示空间表现技法、电脑设计软件应用、广告设计、印刷制稿与工艺、展示模型设计与制作、展示道具设计与制作、人体工程学、材料与预算、国画、书法、会展概论、会展广告及传媒、会展法规、大型活动组织与管理。主要实践环节：写生、采风、市场调研、专业考察、会展企业实习、毕业实习、毕业设计（毕业论文）。</p><p>		相近专业：</p><p>		美术学   艺术设计学   艺术设计   工艺美术</p><p>		主要实践教学环节</p><p>		包括课程实习、毕业实习等。</p><p>		培养目标</p><p>		艺术与科技专业培养德、智、体、美全面发展的、适应现代会展经济产业发展需要的、具有现代会展设计知识与创新能力的优秀人才 。</p><p>		专业培养要求</p><p>		本专业要求学生系统掌握艺术与科技基本理论、基本知识和基本技能，具有进行会展设计、组织策划等的基本能力。</p><p>		毕业生具备的专业知识与能力</p><p>		1.熟悉我国的文艺方针、政策；2.具有本专业的基础理论、基础知识；3.了解艺术与科技的发展动态；4.具有较高的艺术修养、独立完成创作和教学的能力；5.有一定的实际工作能力和初步的科研能力；6.在掌握外语工具方面，应具有较强的阅读本专业书刊的能力，一定的听的能力，初步的写和说的能力。</p>
