special_unique_id,school_id,special_id,sp_name,limit_year,degree,level1_name,level2_name,level3_name,content
33_246,33,246,交通运输,四年,工学学士,本科(普通),工学,交通运输类,"培养目标：培养满足社会经济发展需要，掌握深厚的交通运输基础理论及专业知识，熟悉水路运输相关法规与实务，能够适应水路运输实际的需求，应用数学和科学工具解决复杂工程问题，具备社会责任感、职业道德及人文社会科学素养，具有自主学习和终身学习的能力，有效把握国际前沿问题并进行国际沟通交流，能够从事各层级交通运输管理部门、交通运输企事业单位等技术与管理工作，能够开展交通运输规划、组织、决策与经营的高级技术与管理复合型人才，并在工作中体现出创新意识、环境保护意识及团队合作精神。其中，卓越工程师班采用校企联合的培养模式，在普通班培养目标的基础上，加强学生工程实践能力的培养，按照国家教育部关于卓越工程师教育培养计划的要求，培养面向行业未来发展需要，有较强工程实践能力的交通领域专业技术人才。 <br>

专业特色：交通运输专业先后被评为“国家级特色专业建设点”、“教育部卓越工程师教育培养计划专业”、“辽宁省重点建设专业”、“辽宁省普通高等学校本科工程人才培养模式改革试点专业” “辽宁省实践教学示范中心”、“辽宁省大学生校外实践教育基地”和“大连海事大学精品示范专业”。2012年6月，本专业第一次申请并通过了教育部组织的全国工程教育专业认证，是我校重点建设的具有海运特色的品牌专业之一。本专业在世界航运、港口、海事、外贸以及与之相关的运输服务业和金融业、大专院校和科研院所均具有很高的影响力。 <br>

交通运输专业师资队伍年龄结构合理、学术水平一流、教学经验丰富。专业课程设置丰富合理。 <br>

主要课程：计算机程序设计基础(C++)、工程制图与计算机辅助设计、理论力学、材料力学、运筹与优化、海商法、国际贸易实务、航运经济学、港口工程与规划、船舶货运、控制论基础、港口经济与管理、系统工程、船舶经营决策、工程经济学、海运货物学、港口机械与装卸工艺、交通运输系统分析、租船运输、航空运输、交通运输会计、集装箱码头业务、国际多式联运、港口物流系统仿真、运输网络分析与优化方法、交通运输地理与空间分析、运输包装、机器学习、人工智能、企业工程实训、港口规划与工艺课程设计、货运业务课程设计、运输系统规划课程设计。 <br>"
33_247,33,247,物流工程,四年,管理学学士,本科(普通),管理学,物流管理与工程类,"培养目标：本专业旨在培养具有物流系统工程及管理基础知识，了解物流实务运作与管理相关业务，关注物流行业发展前沿问题，具有创新能力和团队精神的高级物流工程与管理人才。 <br>

专业特色：本专业前身为成立于1989年的航管系综合运输专业，是国内最早设立的培养港航物流工程技术与管理人才的两个专业之一，体现了大连海事大学的传统优势，是学校“双一流”建设的主干专业、也是学校重点建设的航运特色品牌专业方向之一。本专业在我国航运、港口、货运代理及仓储等国际物流行业，以及与之相关的运输服务与金融企业、大专院校和科研院所中均有重要的影响。 <br>

物流工程专业师资队伍年龄职称结构合理、学术水平一流、教学经验丰富，拥有博士学位的比例为90%，还拥有完备的实验教学仪器设备。2006年被确定为学校重点建设的专业之一；2010年获“辽宁省示范专业”；2014年，本专业在辽宁省本科专业评价中名列第一，同时获“辽宁省本科综合改革试点专业”；2015年，本专业获“辽宁省本科优势特色专业”；2018年，获“辽宁省普通高等学校首批一流本科教育示范专业”。 <br>

主要课程：管理运筹学、系统工程、机械设计基础、交通工程学、物流系统仿真、物流中心规划设计、工程物流、项目管理、交通运输规划理论与方法、港口装卸工艺、高级英语技能、国际商务英语、物流方案设计、物流信息系统、运输代理业务、租船运输业务、航运管理、海商法概论等。 <br>"
33_238,33,238,材料科学与工程,四年,工学学士,本科(普通),工学,材料类,"培养目标：本专业致力于培养适应交通运输装备制造业、港口航道运输业及相关行业领域发展需求，具备高度的社会责任感、职业道德及人文社会科学素养,掌握扎实的材料科学与工程领域基础理论、专业知识、工程项目管理知识，拥有丰富的工程实践经验和良好的沟通合作、组织管理、跨文化交流能力，能够从事材料科学研究、技术开发、生产加工、检测检验、腐蚀防护、经营管理等方面工作，并在工作中体现出创新意识、法律意识、环境意识、团队合作精神与国际视野，通过不断的学习实现自我提升从而适应社会经济发展的中高级工程技术人才。 <br>

专业特色：材料科学与工程专业源于上世纪八十年代初成立的大连海事大学船机修造工程及金属材料工艺研究所。目前招生规模为三个自然班，其中高分子材料方向一个班，共90余人。 <br>

本专业现有专职理论课教师30人，实验教师4人。其中博士生导师8人、教授14人、副教授8人、高级实验师1人、讲师8人、实验师3人。30人具有博士学位。 <br>

学生入校后通过本专业四年的学习，可以系统地掌握数学、自然科学知识、工程基础知识及现代材料科学基础理论知识，掌握材料成分、组织结构、性能与加工工艺之间的内在联系，具备解决材料科学与工程领域及相关领域复杂工程问题的能力，毕业后不仅可以在交通运输装备制造业、港口航道运输行业从事材料设计、生产加工、检验检测、腐蚀防护、经营管理等方面的工作，也可以进入新兴材料行业从事新材料研究、应用开发等方面的技术工作。 <br>

此外，材料科学与工程专业也是交通运输部船机修造工程重点实验室的依托单位，现有材料科学与工程学科硕士点、载运工程运用工程学科博士点、交通运输工程及材料加工工程学科专业学位硕士点，每年有近1/3毕业生经保送或考试进入本校或外校继续研究生阶段学习，这为有志于进一步深造的同学提供了更为广阔的发展空间。 <br>

专业所属的本科教学实验室拥有大型实验仪器设备20余台套及各类小型教学仪器设备，配以充足的实验实践教学经费，可为学生完成理论课程学习的同时，提供更多的实践机会以培养解决复杂工程问题的综合能力。 <br>

主要课程：物理化学、材料科学基础、材料化学基础、理论力学、材料力学、材料力学性能、材料物理性能、固态相变及金属热处理、材料分析测试技术、金属材料学、无机非金属材料、材料腐蚀与防护、材料可焊性、计算机在材料科学中的应用、机械设计基础、计算机程序设计基础。 <br>"
33_261,33,261,土木工程,四年,工学学士,本科(普通),工学,土木类,"培养目标：本专业培养具备数学、力学与结构设计等基础理论，掌握土木工程专业知识，以及一定的项目管理、勘察设计、技术经济和人文科学等综合知识的高级工程技术人才。学生面对复杂工程问题具有进行分析、研究并设计解决方案的创新实践能力，选择、使用及开发适当工程工具与技术的综合应用能力，具备良好沟通能力及团队协作精神，具有社会责任感和职业道德素养；毕业后可从事道路、桥梁、隧道及地下工程等各类土木工程的技术与管理工作，经过5年左右的工作实践，达到土木工程专业工程师的水平。 <br>

专业特色：本专业是国家经济建设发展的基础学科，经过多年的发展，建立了一支教学和科研经验丰富的专业教师队伍，现有17名专任教师均具有博士学位，其中教授6名、副教授5名、博士生导师6名。6名教师有国内外知名大学或研究机构的访学经历，多名教师入选辽宁省“百千万人才工程”。 <br>

专业具备硕士研究生、博士研究生和博士后培养资格，拥有土木工程一级硕士点、交通运输工程一级硕士点和道路与铁道工程博士点。其中，“道路与铁道工程”学科为辽宁省重点学科。每年招收硕士、博士研究生约40人。结合我国交通工程发展重大需求与大连海事大学传统优势，在课程设置及教学内容中强化了近海交通工程基础设施建造设计理论与安全性评价、新型海洋交通基础设施材料研发与应用技术以及基于全寿命周期设计的海洋交通基础设施BIM等关键技术三个主要方面，提升了毕业生的就业竞争力，受到用人单位的好评。 <br>

专业拥有交通运输部道桥检测中心及公路工程辽宁省重点实验室，除了常规土工试验教学仪器外，还拥有无线桥梁及结构试验系统、微机控制高温岩石三轴流变仪、海床环境基础模型试验加载系统、弯曲梁流变仪、动态剪切流变仪、结构并行计算分析软件、动态信号采集分析系统、多通道光栅光纤解调仪等大型仪器设备，可充分满足学生专业知识学习及科研训练的要求。除课堂学习外，本专业与多家国内大型施工单位及科研单位签订了教学实习合同，使学生通过接触大型工程现场了解行业最新技术，有效的保证了理论教学与工程实践的紧密结合。 <br>

本专业注重国际交流协作，已与休斯顿大学开展了合作办学，优秀的学生可申请参加“3+1+1”本硕联合培养项目及“1+1+1”双硕士联合培养项目。 <br>

主要课程：理论力学、材料力学、结构力学、画法几何与工程制图、土木工程材料、工程测量、钢筋混凝土结构设计原理、土力学、路基路面工程、道路勘测设计、桥梁工程、岩石力学、隧道工程、道路桥梁工程施工技术、地下建筑结构、地下工程施工、基础工程等。 <br>"
33_254,33,254,物流管理,四年,管理学学士,本科(普通),管理学,物流管理与工程类,"培养目标：本专业主要培养具有物流系统管理基础知识，了解物流实务运作与管理相关业务，关注物流行业发展前沿问题，具有创新能力和团队精神的高级物流管理人才。 <br>

专业特色：本专业面向国家海洋强国战略和交通强国战略，依托专业教师在港航物流的教学与科研上的优势，通过与大型港航物流企业共同开展专业建设，创办了一系列特色方向课程，实现了企业人员授课、海外专家授课、学生上船、进港实习等多种人才培养方式，不断增强学生的实践能力与创新能力的培养，形成了“课内课外、校内校外、专业综合”相衔接的多元化物流人才培养模式，是我校重点建设具有海运特色的品牌专业之一。依托本专业，我校被确立为辽宁省本科紧缺人才培养基地。该专业学生可以参加英国卡迪夫大学商学院“2+2”、“4+1”项目，美国加州大学滨河分校“3+1+1”项目，英国雷丁大学“4+1”项目，英国普利茅斯大学“2+2”、 “3+1”项目，香港航运奖学金项目等。专业立足港航，服务于国际物流，航运特色鲜明，在全国高校和港航物流企业中均有重要影响。专业师资队伍年龄职称结构合理，拥有博士学位的教师比例达100%，学术水平一流、教学经验丰富，专业实验室建设规模和水平位居国内大学同类专业的先进行列。在我国航运、港口、货运代理及仓储等第三方物流行业，以及与之相关的企业、大专院校和科研院所中均有重要的影响。 <br>

主要课程：现代物流概论、供应链管理、管理运筹学、商务统计学、现代优化方法与技术、海商法、国际集装箱运输、国际航运经济学、生产运作管理、城市物流、港口物流理论与实践操作、物流网络与设施规划、仓储管理、运输管理、专业物流实务、科学计算软件、物流信息管理、物流与GIS分析、商业数据分析与挖掘等。 <br>"
33_251,33,251,电子商务,四年,管理学学士,本科(普通),管理学,电子商务类,"培养目标：本专业主要培养具备现代管理和信息经济理念、掌握信息技术和电子服务综合技能、具有扎实的专业基础和良好的知识结构，具备一定的互联网创新创业素质，能从事网络环境下商务运营、专业管理和技术服务的复合型、应用型、创新型专业人才。 <br>

专业特色：本专业高度重视学生创新能力的培养，强调商务与技术的融合、理论与实践的结合，突出信息技术、网络技术、商务智能在电子商务中的地位和作用。本专业围绕电子商务核心价值链，打造“四流（信息流、商流、资金流、物流）合一”的完整课程体系，并不断跟踪电子商务发展前沿优化课程内容，通过“重基础、宽视野、多渠道”的人才培养模式，在培养学生发现问题、分析问题、解决问题能力的基础上，重点培养电子商务系统设计、电子商务平台开发、电子商务管理与运营、商务模式创新、电商大数据分析与应用等专业能力。 <br>

本专业拥有一支学术水平一流、教学经验丰富的教师队伍和先进完备的实验设备，依托管理科学与工程一级学科的学科建设，使专业实验室的规模和水平跻身国内大学同类专业先进行列。 <br>

主要课程：电子商务经济学、运筹学、管理统计学、网络营销、网络金融与电子支付、电子商务网站设计、数据库原理、电子商务信息平台解决方案、商务模式创新、电子商务安全技术、移动商务与协同商务、电商APP开发、电子商务物流系统、商务智能方法与应用、跨境电子商务、电商大数据应用案例分析等。 <br>"
33_229,33,229,国际经济与贸易,四年,经济学学士,本科(普通),经济学,经济与贸易类,"培养目标：本专业旨在培养服务交通、承担海洋强国使命，具有国际视野和民族精神、海洋意识与社会责任、广博知识与发展潜质、创新精神与实践能力、健全人格与健康体魄，具备全球化的战略思维、深厚的理论功底与专门技能，能在涉外经济贸易部门、外资企业、金融机构、港航企业及政府机构、从事实际业务、管理、商务策划工作的高级专门人才。 <br>

专业特色：本专业创建于1994年，在我国海洋运输、货运代理等行业具有较大的影响。本专业贯彻“厚基础、宽口径”的办学宗旨，坚持立足港航，面向社会的办学特色，走国际化办学道路，部分课程实施双语教学。该专业学生可以参加英国卡迪夫大学商学院“2+2”项目、“4+1”项目，英国普利茅斯大学商务经济“3+1”项目，英国雷丁大学“4+1”项目，美国加州大学滨河分校“3+1+1”项目，香港航运奖学金项目等。 <br>

主要课程：国际贸易、微观经济学、宏观经济学、国际经济学、国际贸易实务、国际结算、国际金融、国际服务贸易、国际技术贸易、国际投资、国际市场营销、世界贸易组织、货币银行学、外贸函电、管理学、统计学、跨境电商、海运贸易、外贸运输保险、国际货运代理与租船合同、集装箱运输与多式联运等。 <br>"
33_228,33,228,经济学,四年,经济学学士,本科(普通),经济学,经济学类,"培养目标：本专业的培养定位在于经济基本理论与方法、运输组织与国际贸易的结合，培养掌握现代经济学的数量分析方法，熟悉中国经济运行与改革实践，了解海运、港口系统的构成及金融机构的基本业务，具有国际视野的综合素质高、创新能力强的复合型、应用型的高级国际运输经济人才。 <br>

专业特色：本专业是学校2001年开办的专业。（1）专业定位：在经济理论培养的基础上，培养应用型运输经济、港口经济人才；（2）人才培养模式：基于现代创新教育模式的思想，构建经济学专业创新人才培养的立体化教学模式，以课程为单元，以能力培养为核心，以教学资源为平台，动用所有教学要素，立体化、全方位地融理论学习与实习实践为一体，关注能力和素质教育的全面教学设计；（3）国际化人才培养：吸收借鉴国外先进办学经验和教学理念，提升办学水平，近年与美国肯尼索大学建立了教师互访机制，不断加大与国外高校的合作交流活动。该专业学生可以参加英国卡迪夫大学商学院“2+2”项目、“4+1”项目，英国雷丁大学“4+1”项目、美国加州大学滨河分校“3+1+1”项目，英国普利茅斯大学“2+2”、“3+1”项目。学生通过参加该类项目的学习，达到双方院校的要求后，根据项目的不同可获得我校及国（境）外联合培养院校的学位证书。（4）教学质量监控体系：由教学主管院长、教学督导组、系主任和专业负责人组建本科教学质量监控管理队伍，建立全程质量保证体系，确保本科教学的质量。 <br>

主要课程：微观经济学、宏观经济学、政治经济学、国际经济学、基础会计学、统计学、金融学、计量经济学、财政学、《资本论》与经济学经典著作选读、发展经济学、产业经济学、博弈论与信息经济学、中外经济思想史、管理学、财务管理、国际贸易实务、证券投资学、国际金融、运输经济学、港口经济学、航运经济学、物流经济学、供应链管理等。 <br>"
33_249,33,249,工商管理,四年,管理学学士,本科(普通),管理学,工商管理类,"培养目标：本专业重点围绕交通运输、港口、全球航运及供应链管理等领域的管理活动，培养具有良好职业素养和创新与创业能力，掌握企业生产与服务基本过程，具备分析和解决企业运营、战略管理、财务管理、人力资源和市场营销等管理问题的能力，既能广泛地适应社会环境变化，又能满足特定行业需求的高级复合型管理人才。 <br>

专业特色：本专业始建于1994年，是我国1993年专业目录调整，第一次正式出现工商管理学科后，较早开设工商管理类本科教育的专业之一。专业师资队伍年龄及职称结构合理，教学经验丰富，教学平台丰富，具有“教育部长江学者与创新团队”、“辽宁省高等学校创新团队”等平台的支持，师资学术水平不断提升，并依靠先进的教学设施和方法，不断提高学生的理论基础和实践技能。 <br>

工商管理专业秉承通识教育基础上的特色专业教育理念，在保证学生具有良好职业素养和扎实专业基础的前提下，注重创新与创业能力的培养。同时，本专业以特定行业需求为导向，突出综合性和应用性相结合的办学特色，实施大专业多方向培养方式，目前下设企业管理和市场营销两个方向，学生可在大学二年级根据自己优势自由选择方向。 <br>

本专业学生在国际交流上具有优势，可以参加英国卡迪夫大学商学院“2+2”项目、“4+1”项目，美国加州大学滨河分校“3+1+1”项目，英国雷丁大学“4+1”项目，英国普利茅斯大学“3+1”项目，美国曼达尔学院“1+2+1”项目、“3+1”项目，香港航运奖学金项目等。 <br>

主要课程：管理学、微观经济学、宏观经济学、统计学、基础会计学、管理运筹学、生产与运作管理、人力资源管理、市场营销学、现代物流概论、组织行为学、企业战略管理、企业管理模拟、企业文化、企业社会责任管理、供应链管理、质量管理、港口管理、创业管理、项目管理、航运管理、薪酬管理、运输市场学、创新能力训练、软件操作实训、船舶认知实习等。 <br>"
33_250,33,250,财务管理,四年,管理学学士,本科(普通),管理学,工商管理类,"培养目标：本专业立足于为交通、海事和海洋等领域培养具有国际视野、专业技能和创新精神的高素质财务管理人才。培养掌握会计、投融资、金融和法律等方面的专业知识能力、具有分析和解决财务与金融实践需要的执业资格能力，具备面向未来的职业胜任能力和终身学习能力。 <br>

专业特色：本专业以特定行业需求为导向，坚持“知识能力、职业能力、学习能力”三位一体的人才培养理念，打造精品课程与特色课程为核心的人才培养体系。在坚持全英文讲授专业课程的同时，构建“会计、财务、金融、税法、审计”一体化的实训平台。财务管理课程2007年获得大连海事大学精品课程，2009年获得辽宁省精品课程，2010年获得国家双语教学示范建设课程，2012年获得辽宁省资源共享课程，2013年获来华留学英语授课品牌课程，2016年、2018年、2019年连续获得国家产学合作专业综合改革项目（教育部慕课项目）。本专业在2013年辽宁省高校财务管理专业评估中排名第二。 <br>

本专业师资力量雄厚，教学水平一流，教授比例为20%，拥有博士学位的教师比例为80%。拥有完备的实验教学仪器设备和教学软件，在国内外港口和航运业颇具影响力。 <br>

该专业学生可以参加英国卡迪夫大学商学院“2+2”项目、“4+硕士”项目，美国加州大学滨河分校“3+1+硕士”项目，英国普利茅斯大学“3+1”项目，雷丁大学“4+硕士”项目，法国诺曼底高等商学院校际交换项目，美国曼达尔学院交换项目，香港航运奖学金项目等。 <br>

主要课程：基础会计学、财务管理、中级财务会计、中级财务管理、高级财务管理、高级财务会计、金融学、证券投资学、风险管理与内部控制、港航企业绩效评价、会计信息系统、成本会计、管理会计、财务共享理论与实践、税法、财务报告分析、EXCEL在财务中的应用、纳税实务与技巧、港航企业会计综合实训、国际财务管理等。 <br>"
33_265,33,265,金融工程,四年,经济学学士,本科(普通),经济学,金融学类,"培养目标：本专业培养具有航运金融特色的、国际视野的高端复合型金融工程人才。第一，复合型强调学生具有熟悉金融市场规则、掌握金融产品设计、了解航运行业特点的综合素质；第二，国际化视野强调学生掌握金融业、航运业的国际运作规范，熟悉国际资本运作规则，了解国际金融法规；第三，航运金融特色强调学生掌握航运金融理论知识，了解航运企业运营周期、融资需求。 <br>

专业特色：现代金融行业急需具有金融理论、数学基础、程序设计的复合型人才。传统的金融专业培养已无法满足市场需求。因此本专业高度重视金融工程领域的复合型人才的培养。本专业重视扎实的金融理论，使学生了解金融市场工具、金融机构业务；打牢坚实的数学基础，使学生熟悉复杂金融衍生产品的设计原理；培养熟练的程序设计能力，使学生掌握金融产品开发的能力。 <br>

航运金融业已经进入快速发展时期，相关人才缺口巨大。本专业依托大连海事大学航运、物流等优势学科设置，在金融工程人才培养中，突出航运金融特色，着力融合航运企业的运营与融资特点，使学生能够适应航运金融业的发展。 <br>

本专业师资力量雄厚，教学水平一流，教授比例为30%，教师队伍全部拥有博士学位，专业设置有完备的实验教学仪器设备，学术声誉在国内航运金融领域首屈一指。 <br>

该专业学生可以参加美国加州大学滨河分校“3+1+1”项目，英国普利茅斯大学“2+2”“3+1”项目，英国雷丁大学“4+1”项目，香港航运奖学金项目等。 <br>

主要课程：微观经济学、宏观经济学、管理学、金融学、金融工程学、统计学、会计学、航运金融学、保险学原理、计量经济学、金融计量学、公司金融、金融时间序列、海商法、船舶融资租赁、航运市场学、航运金融案例分析。 <br>"
