special_unique_id,school_id,special_id,sp_name,limit_year,degree,level1_name,level2_name,level3_name,content
33_275,33,275,能源与动力工程,四年,工学学士,本科(普通),工学,能源动力类,"培养目标：本专业培养具备热能工程、传热学、流体力学、动力机械、动力工程等方面基础知识，能在国民经济各部门，从事动力机械和动力工程的设计、制造、运行、管理、实验研究和安装、开发、营销等方面的高级工程技术人才。 <br>

专业特色：本专业成立于2006年。现有专任教师14人（具有博士学位13人），其中教授5人，副教授7人，博士生导师7人。专业经过交通运输部“十一五”、“十二五”重点实验室建设和“211工程”三期重点学科建设，拥有省级科研基地—辽宁省船用小型燃气轮机技术重点实验室，专业建设规模、实验条件和研究能力已达到国内大学同类专业的先进水平。 <br>

主要课程：画法几何与机械制图、机械原理、机械设计、材料力学、理论力学、工程热力学、传热学、工程流体力学、气体动力学、燃气轮机原理、内燃机原理、汽轮机原理、动力机械调节与控制、制冷原理与设备、人工环境与空气调节、制冷装置设计与自动化。 <br>"
33_263,33,263,船舶与海洋工程,四年,工学学士,本科(普通),工学,海洋工程类,"培养目标：本专业培养具备现代化船舶与海洋工程设计、研究、建造的基本技能和管理基础知识、计算机编程及应用能力，能在船舶与海洋工程结构物的设计、研究、制造、检验、使用和管理等部门从事技术和管理方面工作的高级工程技术人才。 <br>
专业特色：本专业建设立足于行业发展趋势，坚持围绕“培养最理解船舶的造船人”的办学理念，努力培养创新素质和工程实践能力突出的船舶与海洋工程专业的拔尖人才。 <br>

本专业现有专任教师18人（博士学位17人），其中教授8人，副教授5人，讲师5人。近年来主持承担了十余项国家级科研项目，专业教师指导的大学生创新创业项目在各类高水平竞赛中获奖50余项。 <br>

专业拥有完善的实验教学基础设施体系，包括船舶设计实验室、循环水槽实验室、流体力学实验室、船舶结构力学实验室、船舶振动实验室等多个船舶与海洋工程专业实验室，实验条件达到国内大学同类专业的先进水平，为培养高水平船舶与海洋工程专业人才奠定基础。 <br> 

主要课程：理论力学、材料力学、船舶与海洋工程流体力学、船舶与海洋工程结构力学、船舶与海洋工程静力学、船舶与海洋工程结构物构造、船舶阻力与推进、船舶操纵性与耐波性、船舶设计原理、船舶与海洋结构物强度、船舶与海洋工程建造工艺、海洋平台设计、潜器设计。 <br>"
33_272,33,272,救助与打捞工程,四年,工学学士,本科(普通),工学,交通运输类,"培养目标：本专业培养了解救助与打捞相关的法律、法规，掌握先进的救捞技术及专业技能，熟悉现代化的救捞设备，能在交通部所属的救助打捞系统、各类海洋工程公司、救助打捞装备研究、设计及制造的研究所、设计所、企业以及救助打捞技术培训的教育机构从事设计、研究、制造、检验、指挥、管理及实施等工作的高级工程技术人才。 <br>

专业特色：本专业（卓越工程师）成立于2009年，2011年获批进入教育部卓越工程师教育培养计划。专业建设紧密围绕国家战略要求和救捞职责，以培养救捞卓越工程师为目标，积极强化工程实践教育，努力提高学生工程素质能力，着力创建提升学生核心竞争力的人才培养新机制。 <br>

经过多年建设，本专业建成了救助技术与装备、打捞技术与装备、海洋工程、海底工程等完备的教学、科研支持平台，承担多项国家级项目，专业教学、科研能力处于国内领先水平。本专业培养的人才在应对和处置各类海上重大突发事件、公益性应急救助、抢险打捞等方面均发挥了重要作用，为保障海上人命、环境和财产安全，维护国家利益和社会稳定做出了重要贡献。 <br>

专业要求：思想政治素质好，热爱救助与打捞事业，组织纪律性强，身体健康。由于工作性质特殊，不适宜女生报考。 <br>

主要课程：画法几何及机械制图、电工学、理论力学、材料力学、机械设计基础、机械制造基础、流体力学、船舶静力学、船舶与海洋工程结构力学、船舶与海洋结构物强度、救助工程、打捞工程、海洋工程、潜水技术基础、救助与打捞政策法规、救捞国际标准合同、救捞应急管理、救捞及海洋工程项目管理。 <br>"
33_258,33,258,机械设计制造及其自动化,四年,工学学士,本科(普通),工学,机械类,"培养目标：本专业培养学生综合运用所学知识分析和解决实际问题的能力，提高专业素质，培养创新能力；能在生产第一线从事机械制造领域内的设计和制造、科技开发、应用研究、运行管理和经营销售等方面工作的高级工程技术人才。 <br>

专业特色：本专业成立于2005年，拥有机械工程一级学科硕士学位授权点。经过十几年的师资队伍建设，目前已形成机械学科门类齐全、具有开拓创新精神、年龄结构合理的教师队伍，现有专任教师20人（全部拥有博士学位），其中教授7人（博士生导师6人），副教授5人（博士生导师2人）。 <br>

本专业建立了设备先进、行业特色明显的机械工程学科基础平台，拥有交通装备先进制造与控制技术辽宁省高校重点实验室，教学、科研条件已达到国内大学同类专业的先进水平。专业团队已经形成船舶机电一体化、流体传动、虚拟制造技术、机械摩擦磨损机理及控制技术、先进制造技术等稳定的科研方向。近五年，完成国家级课题10余项，省部级科研项目20余项，企事业委托项目30余项。 <br>

主要课程：画法几何及机械制图、电工学、理论力学、材料力学、机械原理、机械设计、机械互换性与测量、机械制造工程学、机械工程材料与成型技术、机械工程控制基础、CAD/CAM技术、液压传动、机械工程测试技术、机械系统嵌入式控制、数控技术。 <br>"
33_245,33,245,环境工程,四年,工学学士,本科(普通),工学,环境科学与工程类,"培养目标：本专业主要培养具备扎实的环境工程学科的理论基础，有一定的创新能力、较强的工程实践能力和科技开发基本能力，掌握水污染控制、大气污染控制、固体废物处理处置等基本原理和设计方法，具有环境监测与分析、环境规划和管理能力，能够利用所学知识解决复杂环境工程问题，成为具有技术开发与组织管理能力的高级环境工程技术人才。 <br>

专业特色：本专业始建于1995年，是大连海事大学重点发展的品牌专业之一，辽宁省重点建设学科专业，支持环境科学、环境工程两个二级学科和环境科学与工程一个一级学科博士点。本专业为学校特色专业。 <br>

本专业在海洋环境污染治理与环境规划管理领域享有较高的知名度，居国内高校同类专业领先水平。本专业人才的培养适应社会环境的发展需求，是海洋与交通环境污染控制及环境生态修复、环境保护、环境规划与管理领域专业高级科技人才的主要培养基地，在环境保护、环境污染治理、水运港口及船舶污染控制与管理等行业及相关的大专院校和科研院所有较大影响。本专业目前与美国休斯顿大学建立2+2、3+1、3+1+1等项目合作培养办学，与中国海洋大学环境工程专业建立全日制本科生境内交流学习项目。 <br>

本专业拥有雄厚的教学师资队伍，教授比例占30%，拥有博士学位的比例为98%，专业拥有完备的实验实践教学条件，达到国内同类专业的先进水平。 <br>

主要课程：无机化学、分析化学、物理化学、有机化学、环境化学、环境工程原理、水污染控制工程、大气污染控制工程、固体废物处理与工程、环境工程设计、船舶与港口防污染技术、环境工程微生物学、环境规划与管理、环境影响评价等。 <br>"
33_257,33,257,海洋科学,四年,理学学士,本科(普通),理学,海洋科学类,"培养目标：本专业主要培养具备海洋科学领域所需的基础理论和专业知识，具有较强实验和实践基本技能，掌握海洋调查、监测、海洋开发利用与管理、海洋环境保护等方面基本技能的高级技术人才。 <br>

专业特色：本专业是学校重点发展的特色基础专业之一。坚持立足港航，重点培养学生在海洋污染监测与分析、航运污染治理与生态修复技术、海洋环境管理与规划等方面的基础知识和技能，为海洋行业培养高素质专业人才，为振兴国家沿海产业基地服务。 <br>

本专业拥有雄厚的师资队伍，成员结构合理，专业教师全部具有博士学位。海洋科学专业经过“十一五”和“十二五”的建设，拥有完备的实验教学条件。同时，学校为海洋科学专业配备了国内外一流的海洋调查仪器和设备，并保障本专业学生到学校专用的教学实习船“育鲲”轮上做实践实习。 <br>

主要课程：海洋科学导论、流体力学、物理海洋学、化学海洋学、海洋地质学、海洋生物学、海洋水文气象、海洋遥感技术、海洋管理概论、海洋技术、船舶与港口工程、航道测量学、海洋要素调查等。 <br>"
33_277,33,277,海洋资源与环境,四年,理学学士,本科(普通),理学,海洋科学类,"培养目标：本专业主要培养具有坚实的海洋生态学、环境毒理学和现代生物学分析技术等基本理论和基本知识，具有较强的实践和创新能力，具备海洋生态环境监测与评估、海洋生物技术与资源开发等基本技能，在德、智、体、美全面发展的高级技术人才。 <br>

专业特色：本专业始建于2010年，是根据国内外海洋环境保护、海洋资源开发和利用的最新发展特点，满足国家日益增长的海洋产业发展和海洋资源可持续利用对复合型人才的迫切需求，结合学校办学特色而申请建设的一个新增本科专业。本专业旨在培养适应于海洋生态评估、环境毒理学分析及实时现场检测等管理、研究和开发及应用现代生物学技术实现对海洋生物基因资源的获取和利用等研究和技术开发人才。目前本专业在全国范围内仅有十一所院校开设，排名位于前列。课程设置涉及海洋生物学、环境毒理学、数量生态学、海洋科学、环境规划与管理等多方面内容，为学生提供宽口径就业空间。 <br>

本专业师资力量雄厚、教学资源丰富，专业实验室建设规模和水平达到了国内大学同类专业的先进行列。 <br>

主要课程：大学化学及实验、有机化学及实验、生物化学及实验、海洋生物学、基础生态学、微生物学、细胞生物学及实验、生物信息学、生物统计建模、分子生物学、基因工程、海洋技术、环境毒理学、海洋管理概论、数量生态学、分子标志物和分子诊断技术、环境规划与管理，海洋资源与经济等。 <br>"
33_230,33,230,法学（海商法方向）,四年,法学学士,本科(普通),法学,法学类,"培养目标：本专业方向主要培养具有扎实的英语基础、法学基础，熟悉海运和相关业务，精通海商、海事法律，能够将所学知识综合运用于实践的复合型、国际型、应用型的海事法律高级人才。 <br>

专业特色：本专业是学校特色专业，其课程体系之完备、师资力量之雄厚、学术成果之丰硕在全国法学院校和相关科研单位中居于领先水平，在国内外享有很高的专业知名度。 <br>

（1）航运特色鲜明的“平台+方向”式宽口径职业法律人才培养模式； <br>

（2）强化学生英语能力培养，开展主要专业课全英语和双语教学，使学生成为精通外语和法律的国际型复合型海商法律人才； <br>

（3）多渠道、多方式的国际交流与合作人才培养途径； <br>

（4）全方位、多层次的司法实践教学平台。 <br>

主要课程：法理学、宪法学、民法、刑法、行政法、物权法、债权法、商法、民事诉讼法、国际法、国际私法、海洋法、海商法导论、船舶物权法、船员法、班轮运输实务与法律、租船实务与法律、航运代理实务与法律、海上保险法、海事法、航运金融业务与法律、海事诉讼与仲裁、海事国际私法、专业英语、模拟法庭、案例研习等。 <br>"
33_231,33,231,法学（国际经济法方向）,四年,法学学士,本科(普通),法学,法学类,"培养目标：本专业方向主要培养掌握法学基础理论，能够将所学知识综合运用于业务实践的复合型、国际型、应用型国际经济法律高级专门人才。 <br>

专业特色：本专业紧密结合且充分发挥学校航运优势，在国际贸易法、海洋法等领域享有较高的专业知名度。 <br>

（1）强化学生英语能力培养，主要专业课开展双语教学，使学生成为精通外语和法律的国际型、复合型国际经济法律人才； <br>

（2）多渠道、多方式的国际交流与合作人才培养途径； <br>

（3）全方位、多层次的司法实践教学平台。 <br>

主要课程：法理学、宪法学、民法、刑法、行政法、物权法、债权法、商法、民事诉讼法、国际法、国际私法、海洋法、国际经济法导论、国际税法、国际贸易法、国际金融法、国际技术转让法、国际投资法、反补贴反倾销法、国际商事诉讼与仲裁、专业英语、模拟法庭、案例研习等。 <br>"
33_255,33,255,英语,四年,文学学士,本科(普通),文学,外国语言文学类,"培养目标：培养适应社会主义现代化建设需要，具有良好的英语语言文化素质、扎实系统的英语语言理论基础及运用能力、英美文学赏析能力、航运及商务相关知识和实践能力，并能够在航运、经贸、外事、文化、教育等领域从事语言教学、口笔译、商务管理的高级应用型英语人才。 <br>

专业特色：为适应经济全球化、航运高度国际化的新形势，本专业以社会需求为导向，以市场为驱动，采用“英语 + 专业方向（语言文学、海事商务）”的培养模式，突出海事商务英语的办学特色。 <br>

服务社会，合理定位。依靠学校的航海、航运、交通运输等优势学科，培养具有坚实的英语语言文学基础和扎实的海事、商务相关专业知识和跨文化批判性思维和创新能力、能适应不断发展的航运经济及社会发展需求的复合型、应用型人才。 <br>

需求驱动，特色鲜明。以行业、社会需求为导向，开设特色课程，构建由船舶认识实习、实习实训基地组成的实践教学体系。 <br>

专兼结合，师资保障。英语专业长期坚持班导师制度，伴随学生的大学生活全过程。英语专业通过开放的、多元化的教师资源进行高素质英语人才的培养。 <br>

质量保证，成效显著。英语专业四级、八级考试通过率均超过90%，高出全国平均通过率接近40个百分点。目前，英语专业培养毕业生800多名。毕业生考取硕士和博士研究生比例超过30％，考取的院校包括美国哈佛大学、英国华威大学、帝国理工大学和澳大利亚悉尼大学，国内的北外、上外、广外、浙大、上海交大、复旦大学、对外经济贸易大学等知名学府。 <br>

主要课程：基础英语、高级英语、英语视听、英语口语、英语写作、英语口译、英语笔译、语言学概论、英国文学、美国文学、学术论文写作、第二外语、海事翻译、航海概论及海事管理、商务英语写作、国际商务基础。 <br>"
33_256,33,256,日语,四年,文学学士,本科(普通),文学,外国语言文学类,"培养目标：本专业设有计算机信息管理日语专业方向，培养适应社会主义现代化建设需要，具有良好的日语语言文化素质、扎实系统的日语语言理论基础、日语语言运用能力、日本文学作品的鉴赏能力和实践能力，并能够在经贸、外事、文化、教育、大众传媒等领域工作的高级复合型应用型日语人才。 <br>

专业特色：本专业方向为“日语+计算机信息管理”，以行业、社会需求为导向，开设特色课程，培养语言能力强，同时具备计算机信息管理技能的高素质复合型人才，办学优势突出，特色鲜明。 <br>

服务社会，合理定位。本专业培养适应国家和区域经济社会发展以及IT行业（软件外包服务）发展需要的，具有良好的日语语言理论知识、计算机管理专业知识和实践能力的复合型、高素质人才。 <br>

“精英”教育，成效显著。本专业秉承“精英”教育理念，坚持小班（不超过20人）授课，教学效果显著，人才培养质量高。毕业生考取国内外重点高校的硕士研究生的平均比例为45%，考取院校包括中国人民大学、南京大学等国内知名大学及日本东京大学、京都大学、大阪大学、名古屋大学等日本知名大学。毕业生就职于埃森哲信息技术有限公司、IBM、爱立信、戴尔、简伯特、华信等IT知名企业。 <br>

专兼结合，师资保障。现有专任教师15人，另有长期聘用日籍教师2人。中方教师中教授43人、副教授5人，高级职称比例53.3%；博士和在读博士10人，占教师总数的66.7%。除专业外教，每年邀请国内外知名专家来校讲学。 <br>

主要课程：日语精读、日语会话、高级日语、日语听力、日语口语、现代(古典)语法、日语翻译、日语口译、大学英语（陆上较高要求）、语言学概论、日本文学史。 <br>"
33_252,33,252,行政管理,四年,管理学学士,本科(普通),管理学,公共管理类,"培养目标：本专业主要培养适应国家治理现代化需要，具备行政管理等相关领域专业知识，掌握先进管理方法，具有现代行政管理基本素养和较强实践工作能力，能够在政府机构与非政府公共组织，特别是港航企事业单位以及交通运输系统等从事管理工作的高级专门人才。 <br>

专业特色：本专业从1983年开始招生，1988年正式招收本科生。本专业突出港航特色，培养既具有较强理论基础，又掌握港航企事业单位实践技能，了解港航企事业特点的高级专业人才，目前已发展成为实力较强并具有突出海事特色的管理类专业，具有良好的发展前景。 <br>

主要课程：管理学概论、行政管理学、政治学原理、公文写作、行政法与行政诉讼法、公共部门人力资源管理、公共管理学、公共关系学、领导科学、公共政策分析、公共组织学、地方政府学、国际航运政策、交通运输学、海商法、航海概论、公共经济学、公共部门绩效管理、公共危机管理、管理文秘等。 <br>"
33_253,33,253,公共事业管理,四年,管理学学士,本科(普通),管理学,公共管理类,"培养目标：本专业主要培养适应社会主义现代化建设需要，具备公共管理学、经济学、政治学、法学、社会学和交通运输学知识，具有现代公共管理理论和公共政策基本素养，掌握先进管理方法，适应办公自动化，应用计算机技能，写作能力强，能够在政府部门与非政府公共机构，特别是交通港航系统从事管理工作的应用型、复合型高级专门人才。 <br>

专业特色：本专业作为国家新兴专业，学校自2001年开始招收本科生，是国内较早开设公共事业管理专业的高等院校。本专业注重研究性、实用性和综合性，将公共管理一般理论与方法学习与交通港航事业管理实务相联系，以“培养一流的公共管理人才，推进交通运输管理现代化”为培养目标，坚持“立足交通港航，面向全国”的办学特色，培养注重实践教学，在国内政府部门、企事业单位、社会组织中建立多个教学实践基地 。 <br>

主要课程：管理学、经济学、政治学、社会学、公共管理学、公共经济学、公共政策分析、公共部门人力资源管理、公共关系学、公共组织学、公共部门绩效管理、公共危机管理、社会保障与社会福利、行政管理学、非营利组织管理、交通运输公共管理学、航运管理、港口管理、运输经济学、国际航运政策、中国海洋政治战略等。 <br>"
33_232,33,232,政治学与行政学,四年,法学学士,本科(普通),法学,政治学类,"培养目标：本专业主要培养符合当代政治发展需要，具有专业的政治思考能力，掌握政治学与行政学的基础理论和基本方法，了解国家政治制度、政府行政体制的运作模式和交通系统政务的工作流程，拥有对国家和政府事务方面的领导决策潜力能力和交通系统业务的组织管理技能，能够在各级党政机关、交通运输等各企事业单位从事政治决策和行政工作，也能够继续深造而从事专业教学和科研工作的复合型人才。 <br>

专业特色：本专业是人文社会科学中的基础性专业，注重一般性政治学与行政学问题学习，突出交通政务领域的学习。通过对历史和现实中政治现象和行政问题的深入探讨，赋予学生专业知识和专业视角，培育学生独立的思考能力和认知能力以及独立获取知识、提出问题、分析问题和解决问题的基本能力及开拓创新的精神，使学生具备从事本专业业务工作的必备能力和适应相邻专业业务工作的基本素质。本专业拥有一支搭配合理的优秀师资队伍，教师全部拥有博士学位。 <br>

主要课程：政治学原理、行政学概论、比较政治制度、西方政治思想史、中国政治思想史、电子政务、国际政治学、政党学、当代中国政府与政治、市政学、公共政策分析、公共经济学、公共部门人力资源管理、政治传播学、当代西方政治思潮、中国社会政治分析、政治学方法论、政治社会学、公共管理学、政治哲学等。 <br>"
33_267,33,267,社会工作,四年,法学学士,本科(普通),法学,社会学类,"培养目标：本专业培养具有扎实的社会工作理论和实务素质，能够胜任社会调研和社会活动策划工作，具备海事社会工作介入能力的专业社会工作人才。 <br>

专业特色：本专业立足学校航运特色和业缘优势，将“海事社会工作”作为主要发展领域，积极培养学生在海员船上关系协调、危机干预、船下社会化整合、权益倡导、家庭服务等领域的理论和实务能力。本专业注重学生实务素养的培育，在专业教学中，鼓励学生自主开展社会调研，积极利用各种资源策划开展社会活动，真正做到学以致用。 <br>

主要课程：社会学概论、社会工作概论、社会调查方法、社会统计学、人类行为与社会环境、社会心理学、发展社会学、海洋社会学、个案社会工作、农村社会学、组织社会学、社会保障与社会福利、团体社会工作、船员心理学、公共政策分析、社区工作、初级社会工作实务、心理咨询、海事社会工作等。 <br>"
33_264,33,264,数学与应用数学,四年,理学学士,本科(普通),理学,数学类,"培养目标：本专业培养掌握数学科学的基本理论和方法，具备灵活运用数学与应用数学的思想方法，使用计算机解决实际问题的能力，能在科学研究、技术开发、教育、经济和管理等部门从事研究、教学、实际应用开发和管理工作的高级专门人才。也可以继续深造，攻读数学或相关学科的硕士。 <br>

专业特色：本专业一直重视教学、创新人才培养和科研并举的模式。在专业发展规划和人才培养方案中，注重培养学生掌握数学科学的基本理论与基本方法，受到数学模型、计算机和数学软件方面的基本训练，在数学理论和应用两方面都受到良好的教育，具有较好的科学素养和较强的创新意识，初步具备科学研究、教学、解决实际问题及开发软件等方面的基本能力和较强的更新知识的能力，并把这种理念贯穿于四年的教学与管理过程中。 <br>

主要课程：数学分析、高等代数、解析几何、常微分方程、概率论基础、数值分析、数学软件与实验、实变函数、复变函数、泛函分析、数据结构、微分几何、拓扑学、数学建模等。 <br>"
